{
  "$schema": "./profile.schema.json",
  "profileId": "example-wormhole-axelar-wsteth",
  "repositoryUrl": "https://github.com/wormhole-foundation/example-wormhole-axelar-wsteth",
  "default": {
    "github_repo": {
      "relative_root": ""
    },
    "dependencies": {
      "lib/openzeppelin-contracts-upgradeable/lib/openzeppelin-contracts": {
        "url": "https://github.com/OpenZeppelin/openzeppelin-contracts",
        "commit": "dbb6104ce834628e473d2173bbc9d47f81a9eec3",
        "relative_root": ""
      },
      "lib/openzeppelin-contracts-upgradeable": {
        "url": "https://github.com/OpenZeppelin/openzeppelin-contracts-upgradeable",
        "commit": "723f8cab09cdae1aca9ec9cc1cfa040c2d4b06c1",
        "relative_root": ""
      },
      "lib/openzeppelin-contracts": {
        "url": "https://github.com/OpenZeppelin/openzeppelin-contracts",
        "commit": "dbb6104ce834628e473d2173bbc9d47f81a9eec3",
        "relative_root": ""
      },
      "lib/example-native-token-transfers": {
        "url": "https://github.com/wormhole-foundation/example-native-token-transfers",
        "commit": "0d37b0f4975084492c72ca881c1218d6e1aae9e3",
        "relative_root": ""
      }
    }
  },
  "commits": {
    "eae15a0dd4a55481c8bf776c250d86bf0529a061": {}
  }
}
