{
  "$schema": "./profile.schema.json",
  "profileId": "linea-monorepo",
  "repositoryUrl": "https://github.com/Consensys/linea-monorepo",
  "description": "Consensys' Linea monorepo; the canonical TokenBridge sources live under contracts/src/bridging/token.",
  "default": {
    "github_repo": {
      "relative_root": "contracts"
    },
    "dependencies": {
      "@openzeppelin/contracts": {
        "url": "https://github.com/OpenZeppelin/openzeppelin-contracts",
        "commit": "dc44c9f1a4c3b10af99492eed84f83ed244203f6",
        "relative_root": "contracts"
      },
      "@openzeppelin/contracts-upgradeable": {
        "url": "https://github.com/OpenZeppelin/openzeppelin-contracts-upgradeable",
        "commit": "2d081f24cac1a867f6f73d512f2022e1fa987854",
        "relative_root": "contracts"
      }
    }
  },
  "commits": {
    "e32aa290cfb7e1df7abebc456bc4b3a8abbfda3f": {}
  }
}
