{
  "$schema": "./profile.schema.json",
  "profileId": "aave-delivery-infrastructure",
  "repositoryUrl": "https://github.com/lidofinance/aave-delivery-infrastructure",
  "default": {
    "github_repo": {
      "relative_root": ""
    },
    "dependencies": {
      "lib/openzeppelin-contracts": {
        "url": "https://github.com/OpenZeppelin/openzeppelin-contracts",
        "commit": "e1b3d8c7ee2c97868f4ab107fe8b7e19f0a8db9f",
        "relative_root": ""
      },
      "lib/solidity-utils": {
        "url": "https://github.com/bgd-labs/solidity-utils",
        "commit": "56720adb8b751c3742a5f9b8c5bcb8a9446ba941",
        "relative_root": ""
      }
    }
  },
  "commits": {
    "41c81975c2ce5b430b283e6f4aab922c3bde1555": {}
  }
}
