{
  "$schema": "./profile.schema.json",
  "profileId": "scroll",
  "repositoryUrl": "https://github.com/scroll-tech/scroll",
  "description": "Scroll's own monorepo; the Lido wstETH gateway and L2WstETHToken live under contracts/src/lido.",
  "default": {
    "github_repo": {
      "relative_root": "contracts"
    },
    "dependencies": {
      "lib/openzeppelin-contracts": {
        "url": "https://github.com/OpenZeppelin/openzeppelin-contracts",
        "commit": "49c0e4370d0cc50ea6090709e3835a3091e33ee2",
        "relative_root": ""
      },
      "@openzeppelin/contracts": {
        "url": "https://github.com/OpenZeppelin/openzeppelin-contracts",
        "commit": "fd81a96f01cc42ef1c9a5399364968d0e07e9e90",
        "relative_root": "contracts"
      },
      "@openzeppelin/contracts-upgradeable": {
        "url": "https://github.com/OpenZeppelin/openzeppelin-contracts-upgradeable",
        "commit": "3d4c0d5741b131c231e558d7a6213392ab3672a5",
        "relative_root": "contracts"
      }
    }
  },
  "commits": {
    "69224ebb935d499c055c7859c1c8ade57244249c": {}
  }
}
