{
  "$schema": "./profile.schema.json",
  "profileId": "scroll-governance-crosschain-bridges",
  "repositoryUrl": "https://github.com/scroll-tech/governance-crosschain-bridges",
  "description": "Scroll's fork of the Aave/Lido governance bridge executors; ScrollBridgeExecutor exists only here.",
  "default": {
    "github_repo": {
      "relative_root": ""
    },
    "dependencies": {
      "@openzeppelin/contracts": {
        "url": "https://github.com/OpenZeppelin/openzeppelin-contracts",
        "commit": "fd81a96f01cc42ef1c9a5399364968d0e07e9e90",
        "relative_root": "contracts"
      },
      "@openzeppelin/contracts-upgradeable": {
        "url": "https://github.com/OpenZeppelin/openzeppelin-contracts-upgradeable",
        "commit": "3d4c0d5741b131c231e558d7a6213392ab3672a5",
        "relative_root": "contracts"
      }
    }
  },
  "commits": {
    "d023beed13f9b7f77c062b8fee43476788e48343": {}
  }
}
